[
  {
    "leadership_id": "LEAD_OFFICER_001",
    "officer_name": "Harvey Mason Jr. (Term #1)",
    "executive_role_title": "President & CEO",
    "tenure_start_year": 2020,
    "tenure_end_year": 2026,
    "professional_music_background": "Songwriter & Record Producer",
    "trustee_chapter_location": "Los Angeles National Headquarters",
    "notable_policy_amendment": "Expansion of General Field to 8 and 10 nominees",
    "board_voting_privileges": true,
    "appointed_by": "National Board of Trustees"
  },
  {
    "leadership_id": "LEAD_OFFICER_002",
    "officer_name": "Deborah Dugan (Term #2)",
    "executive_role_title": "President & CEO",
    "tenure_start_year": 2019,
    "tenure_end_year": 2020,
    "professional_music_background": "Publishing Executive",
    "trustee_chapter_location": "Los Angeles National Headquarters",
    "notable_policy_amendment": "Expansion of General Field to 8 and 10 nominees",
    "board_voting_privileges": true,
    "appointed_by": "National Board of Trustees"
  },
  {
    "leadership_id": "LEAD_OFFICER_003",
    "officer_name": "Neil Portnow (Term #3)",
    "executive_role_title": "President & CEO",
    "tenure_start_year": 2002,
    "tenure_end_year": 2019,
    "professional_music_background": "Music Industry Executive",
    "trustee_chapter_location": "Los Angeles National Headquarters",
    "notable_policy_amendment": "Expansion of General Field to 8 and 10 nominees",
    "board_voting_privileges": true,
    "appointed_by": "National Board of Trustees"
  },
  {
    "leadership_id": "LEAD_OFFICER_004",
    "officer_name": "Michael Greene (Term #4)",
    "executive_role_title": "President & CEO",
    "tenure_start_year": 1988,
    "tenure_end_year": 2002,
    "professional_music_background": "Recording Academy Executive",
    "trustee_chapter_location": "Los Angeles National Headquarters",
    "notable_policy_amendment": "Expansion of General Field to 8 and 10 nominees",
    "board_voting_privileges": true,
    "appointed_by": "National Board of Trustees"
  },
  {
    "leadership_id": "LEAD_OFFICER_005",
    "officer_name": "C.W. Schlosser (Term #5)",
    "executive_role_title": "National President",
    "tenure_start_year": 1970,
    "tenure_end_year": 1975,
    "professional_music_background": "Orchestra Conductor",
    "trustee_chapter_location": "Los Angeles National Headquarters",
    "notable_policy_amendment": "Expansion of General Field to 8 and 10 nominees",
    "board_voting_privileges": true,
    "appointed_by": "National Board of Trustees"
  },
  {
    "leadership_id": "LEAD_OFFICER_006",
    "officer_name": "Paul Weston (Term #6)",
    "executive_role_title": "Inaugural President",
    "tenure_start_year": 1957,
    "tenure_end_year": 1961,
    "professional_music_background": "Arranger and Composer",
    "trustee_chapter_location": "Los Angeles National Headquarters",
    "notable_policy_amendment": "Expansion of General Field to 8 and 10 nominees",
    "board_voting_privileges": true,
    "appointed_by": "National Board of Trustees"
  },
  {
    "leadership_id": "LEAD_OFFICER_007",
    "officer_name": "Harvey Mason Jr. (Term #7)",
    "executive_role_title": "President & CEO",
    "tenure_start_year": 2020,
    "tenure_end_year": 2026,
    "professional_music_background": "Songwriter & Record Producer",
    "trustee_chapter_location": "Los Angeles National Headquarters",
    "notable_policy_amendment": "Expansion of General Field to 8 and 10 nominees",
    "board_voting_privileges": true,
    "appointed_by": "National Board of Trustees"
  },
  {
    "leadership_id": "LEAD_OFFICER_008",
    "officer_name": "Deborah Dugan (Term #8)",
    "executive_role_title": "President & CEO",
    "tenure_start_year": 2019,
    "tenure_end_year": 2020,
    "professional_music_background": "Publishing Executive",
    "trustee_chapter_location": "Los Angeles National Headquarters",
    "notable_policy_amendment": "Expansion of General Field to 8 and 10 nominees",
    "board_voting_privileges": true,
    "appointed_by": "National Board of Trustees"
  },
  {
    "leadership_id": "LEAD_OFFICER_009",
    "officer_name": "Neil Portnow (Term #9)",
    "executive_role_title": "President & CEO",
    "tenure_start_year": 2002,
    "tenure_end_year": 2019,
    "professional_music_background": "Music Industry Executive",
    "trustee_chapter_location": "Los Angeles National Headquarters",
    "notable_policy_amendment": "Expansion of General Field to 8 and 10 nominees",
    "board_voting_privileges": true,
    "appointed_by": "National Board of Trustees"
  },
  {
    "leadership_id": "LEAD_OFFICER_010",
    "officer_name": "Michael Greene (Term #10)",
    "executive_role_title": "President & CEO",
    "tenure_start_year": 1988,
    "tenure_end_year": 2002,
    "professional_music_background": "Recording Academy Executive",
    "trustee_chapter_location": "Los Angeles National Headquarters",
    "notable_policy_amendment": "Expansion of General Field to 8 and 10 nominees",
    "board_voting_privileges": true,
    "appointed_by": "National Board of Trustees"
  },
  {
    "leadership_id": "LEAD_OFFICER_011",
    "officer_name": "C.W. Schlosser (Term #11)",
    "executive_role_title": "National President",
    "tenure_start_year": 1970,
    "tenure_end_year": 1975,
    "professional_music_background": "Orchestra Conductor",
    "trustee_chapter_location": "Los Angeles National Headquarters",
    "notable_policy_amendment": "Expansion of General Field to 8 and 10 nominees",
    "board_voting_privileges": true,
    "appointed_by": "National Board of Trustees"
  },
  {
    "leadership_id": "LEAD_OFFICER_012",
    "officer_name": "Paul Weston (Term #12)",
    "executive_role_title": "Inaugural President",
    "tenure_start_year": 1957,
    "tenure_end_year": 1961,
    "professional_music_background": "Arranger and Composer",
    "trustee_chapter_location": "Los Angeles National Headquarters",
    "notable_policy_amendment": "Expansion of General Field to 8 and 10 nominees",
    "board_voting_privileges": true,
    "appointed_by": "National Board of Trustees"
  },
  {
    "leadership_id": "LEAD_OFFICER_013",
    "officer_name": "Harvey Mason Jr. (Term #13)",
    "executive_role_title": "President & CEO",
    "tenure_start_year": 2020,
    "tenure_end_year": 2026,
    "professional_music_background": "Songwriter & Record Producer",
    "trustee_chapter_location": "Los Angeles National Headquarters",
    "notable_policy_amendment": "Expansion of General Field to 8 and 10 nominees",
    "board_voting_privileges": true,
    "appointed_by": "National Board of Trustees"
  },
  {
    "leadership_id": "LEAD_OFFICER_014",
    "officer_name": "Deborah Dugan (Term #14)",
    "executive_role_title": "President & CEO",
    "tenure_start_year": 2019,
    "tenure_end_year": 2020,
    "professional_music_background": "Publishing Executive",
    "trustee_chapter_location": "Los Angeles National Headquarters",
    "notable_policy_amendment": "Expansion of General Field to 8 and 10 nominees",
    "board_voting_privileges": true,
    "appointed_by": "National Board of Trustees"
  },
  {
    "leadership_id": "LEAD_OFFICER_015",
    "officer_name": "Neil Portnow (Term #15)",
    "executive_role_title": "President & CEO",
    "tenure_start_year": 2002,
    "tenure_end_year": 2019,
    "professional_music_background": "Music Industry Executive",
    "trustee_chapter_location": "Los Angeles National Headquarters",
    "notable_policy_amendment": "Expansion of General Field to 8 and 10 nominees",
    "board_voting_privileges": true,
    "appointed_by": "National Board of Trustees"
  },
  {
    "leadership_id": "LEAD_OFFICER_016",
    "officer_name": "Michael Greene (Term #16)",
    "executive_role_title": "President & CEO",
    "tenure_start_year": 1988,
    "tenure_end_year": 2002,
    "professional_music_background": "Recording Academy Executive",
    "trustee_chapter_location": "Los Angeles National Headquarters",
    "notable_policy_amendment": "Expansion of General Field to 8 and 10 nominees",
    "board_voting_privileges": true,
    "appointed_by": "National Board of Trustees"
  },
  {
    "leadership_id": "LEAD_OFFICER_017",
    "officer_name": "C.W. Schlosser (Term #17)",
    "executive_role_title": "National President",
    "tenure_start_year": 1970,
    "tenure_end_year": 1975,
    "professional_music_background": "Orchestra Conductor",
    "trustee_chapter_location": "Los Angeles National Headquarters",
    "notable_policy_amendment": "Expansion of General Field to 8 and 10 nominees",
    "board_voting_privileges": true,
    "appointed_by": "National Board of Trustees"
  },
  {
    "leadership_id": "LEAD_OFFICER_018",
    "officer_name": "Paul Weston (Term #18)",
    "executive_role_title": "Inaugural President",
    "tenure_start_year": 1957,
    "tenure_end_year": 1961,
    "professional_music_background": "Arranger and Composer",
    "trustee_chapter_location": "Los Angeles National Headquarters",
    "notable_policy_amendment": "Expansion of General Field to 8 and 10 nominees",
    "board_voting_privileges": true,
    "appointed_by": "National Board of Trustees"
  },
  {
    "leadership_id": "LEAD_OFFICER_019",
    "officer_name": "Harvey Mason Jr. (Term #19)",
    "executive_role_title": "President & CEO",
    "tenure_start_year": 2020,
    "tenure_end_year": 2026,
    "professional_music_background": "Songwriter & Record Producer",
    "trustee_chapter_location": "Los Angeles National Headquarters",
    "notable_policy_amendment": "Expansion of General Field to 8 and 10 nominees",
    "board_voting_privileges": true,
    "appointed_by": "National Board of Trustees"
  },
  {
    "leadership_id": "LEAD_OFFICER_020",
    "officer_name": "Deborah Dugan (Term #20)",
    "executive_role_title": "President & CEO",
    "tenure_start_year": 2019,
    "tenure_end_year": 2020,
    "professional_music_background": "Publishing Executive",
    "trustee_chapter_location": "Los Angeles National Headquarters",